{
  "id": "e5f6a7b8-c9d0-1234-ef01-23456789abcd",
  "subject": "Re: Phase 2 Progress Update",
  "from": {
    "name": "Alice Smith",
    "address": "alice@example.com"
  },
  "to": [
    {
      "name": "Bob Jones",
      "address": "bob@example.com"
    }
  ],
  "cc": [
    {
      "address": "team@example.com"
    }
  ],
  "bcc": [],
  "body_text": "Hi Bob,\n\nPhase 2 is on track. All canonical schemas are defined.\n\nBest,\nAlice",
  "body_html": "<p>Hi Bob,</p><p>Phase 2 is on track. All canonical schemas are defined.</p><p>Best,<br>Alice</p>",
  "date": "2026-03-23T15:30:00Z",
  "message_id": "<msg-12345@example.com>",
  "in_reply_to": "<msg-12340@example.com>",
  "attachments": [
    {
      "filename": "progress-report.pdf",
      "mime_type": "application/pdf",
      "size_bytes": 245760,
      "content_id": "att-001"
    }
  ],
  "read": true,
  "starred": false,
  "labels": ["inbox", "project-updates"],
  "source": "gmail",
  "source_id": "gmail-msg-xyz789",
  "extensions": {
    "com.gmail.plugin": {
      "thread_id": "thread-abc",
      "importance": "normal"
    }
  },
  "created_at": "2026-03-23T15:30:00Z",
  "updated_at": "2026-03-23T16:00:00Z"
}
