{
  "id": "550e8400-e29b-41d4-a716-446655440000",
  "subject": "Re: Plugin SDK API review — feedback requested",
  "from": {
    "name": "GitHub Notifications",
    "address": "notifications@github.com"
  },
  "to": [
    { "address": "developer@company.com" }
  ],
  "cc": [
    { "address": "team-leads@company.com" }
  ],
  "bcc": [
    { "address": "archive@company.com" }
  ],
  "body_text": "The latest SDK changes look good. I have a few minor suggestions on the type definitions.",
  "body_html": "<p>The latest SDK changes look good. I have a few minor suggestions on the type definitions.</p>",
  "date": "2026-01-15T10:30:00Z",
  "message_id": "sdk-review-msg-001@github.com",
  "in_reply_to": "sdk-review-original@github.com",
  "attachments": [
    {
      "filename": "sdk-review-notes.pdf",
      "mime_type": "application/pdf",
      "size_bytes": 128000
    }
  ],
  "read": true,
  "starred": false,
  "labels": ["inbox", "development"],
  "source": "imap",
  "source_id": "fixture-email-001",
  "created_at": "2026-01-15T10:30:00Z",
  "updated_at": "2026-01-15T10:30:00Z"
}
